{
  "schemaVersion": "0.1",
  "status": "preview",
  "coreVersion": "1.4.1",
  "bootstrap": {
    "canonicalVersion": "5.3.3",
    "targetRange": ">=5.3.0 <5.4",
    "verifiedRange": ">=5.3.0 <5.4",
    "testedVersions": ["5.3.0", "5.3.3", "5.3.8"]
  },
  "browserPolicy": {
    "policy": "Certification is in progress; see SUPPORT.md for the intended browser policy.",
    "exactEvidenceInAttestation": false
  },
  "certifiedComponents": [],
  "publicEntrypoints": {
    "css": [
      "./moo-ui.css",
      "./moo-ui.min.css",
      "./moo.css",
      "./moo.min.css"
    ],
    "esm": [
      "./moo-ui.js",
      "./moo-ui.min.js",
      "./combobox.js",
      "./sidebar.js",
      "./context-menu.js",
      "./datatable.js",
      "./slider.js",
      "./toc.js",
      "./overlay-scrollbar.js",
      "./table-of-contents.js",
      "./sheet.js",
      "./chart.js",
      "./chart.min.js",
      "./datepicker.js",
      "./datepicker.min.js"
    ],
    "sass": [
      "./scss/config",
      "./scss/moo-ui",
      "./scss/moo-core",
      "./scss/components",
      "./scss/settings"
    ],
    "browser": [
      "./state.js"
    ],
    "metadata": [
      "./certification.json",
      "./package.json",
      "./release-manifest.json"
    ]
  },
  "supportPolicy": "https://github.com/wpmoo-org/ui/blob/main/SUPPORT.md"
}
